id,name
131,"Something being deflected from something.An object angled away from a surface, with its trajectory visibly altered by contact, positioned near but not touching the original path."
132,"Something colliding with something and both are being deflected.Two objects in contact, each deflecting away from the collision point at opposing angles, their surfaces deformed at the impact site."
133,"Something colliding with something and both come to a halt.Two objects in direct contact, motionless, their surfaces pressed together at the point of impact with no visible gap between them."
134,"Something falling like a feather or paper.A light object drifts downward, tilting slightly, edges curling softly, suspended mid-air as if floating gently without haste."
135,"Something falling like a rock.An object is positioned mid-air, descending vertically with its bottom facing downward, resembling the shape and orientation of a falling rock."
136,"Spilling something behind something.A liquid or small objects are scattered on a surface, positioned to the rear of another object, with the spilled material extending outward from behind it."
137,"Spilling something next to something.A liquid flows out of a container, forming a puddle adjacent to another object. The container tilts, directing the spill toward the nearby item."
138,"Spilling something onto something.A liquid or small objects flow downward from a container's edge, spreading unevenly across a surface below, with some droplets suspended mid-air."
139,"Spinning something so it continues spinning.A hand grips an object, fingers curled around its sides. The wrist twists sharply, releasing the object as it rotates rapidly in mid-air."
140,"Spinning something that quickly stops spinning.An object rotates rapidly, its motion abruptly halting, leaving it still. The spinning axis remains vertical, with no visible tilt or wobble during the stop."
141,"Spreading something onto something.A flat object is held above a surface, with a substance evenly distributed across it, gently pressing downward to cover the area smoothly."
142,"Sprinkling something onto something.Fine particles scatter downward from above, dispersing unevenly over a surface below. Some particles rest atop, others settle into crevices or bounce lightly away."
143,"Squeezing something.A hand wraps around an object, fingers pressing inward, creating visible indentations on its surface as the palm supports the compression."
144,"Stacking number of something.Several objects are vertically aligned, with each one resting directly on top of another, forming a straight, upward column."
145,"Stuffing something into something.A hand holding an object is positioned above the opening of a container, with the object partially inserted into the container's cavity."
146,"Taking one of many similar things on the table.A hand reaches toward multiple identical objects scattered on a table, fingers poised to grasp one near the center."
147,"Taking something from somewhere.A hand reaches toward an object placed on a surface, fingers slightly curled, poised to grasp it. The object rests within easy reach, aligned with the hand's trajectory."
148,"Taking something out of something.A hand reaches into an open container, fingers grasping an object partially visible inside, lifting it upward and out of the opening."
149,"Tearing something into two pieces.Two hands grip opposite edges of an object, pulling in opposite directions. The object is stretched, with a visible split forming at the center."
150,"Tearing something just a little bit.Fingers grip the edges of an object, pulling gently apart. A small gap forms between the two sides, revealing a thin, uneven tear line."
151,"Throwing something.A hand grips an object, arm extended backward, elbow bent. The object is positioned above the shoulder, ready to propel forward."
152,"Throwing something against something.An object is held in a hand, positioned above and away from the body, with another surface or object nearby as the target. The hand is angled toward the target."
153,"Throwing something in the air and catching it.An object is suspended mid-air above an open, upward-facing hand, with the hand positioned below the object's current trajectory."
154,"Throwing something in the air and letting it fall.An object is suspended mid-air above an outstretched hand, with the hand positioned below the object's current trajectory. Gravity pulls the object downward."
155,"Throwing something onto a surface.A hand holds an object above a flat surface, fingers slightly open, poised to release the object downward onto the surface below."
156,"Tilting something with something on it slightly so it doesn't fall down.An object rests on a surface, slightly inclined, with another item balanced atop it, neither sliding off nor toppling."
157,"Tilting something with something on it until it falls off.An object rests on a slanted surface, positioned at an angle where gravity causes it to slide off gradually. The supporting surface is tilted beyond the object's balance point."
158,"Tipping something over.An object leans at an angle, its base no longer flat on the surface, with one edge lifted while the opposite side remains in contact."
159,"Tipping something with something in it over, so something in it falls out.An object is tilted at an angle, causing its contents to spill out from the opening due to gravity's pull."
160,"Touching (without moving) part of something.A hand's fingers gently rest on a surface, making light contact without pressure or movement, the fingertips aligned flat against the object's texture."
161,"Trying but failing to attach something to something because it doesn't stick.A hand holds an object near a surface, but the object does not adhere, leaving a small gap between them."
162,"Trying to bend something unbendable so nothing happens.A person grips a rigid, straight object with both hands, applying force to bend it, but the object remains unchanged in shape and position."
163,"Trying to pour something into something, but missing so it spills next to it.A hand tilts a container, pouring liquid towards an opening, but the stream misses, spilling onto the surface beside it."
164,"Turning something upside down.An object is inverted with its original top now facing downward, and its original bottom positioned upward, altering its spatial orientation completely."
165,"Turning the camera downwards while filming something.The camera tilts downward, with its lens pointing toward the ground, positioned above the subject being filmed. The view shifts from higher to lower elevation."
166,"Turning the camera left while filming something.The camera rotates horizontally to the left, shifting the frame's right side inward while the left side expands outward, maintaining a fixed central axis."
167,"Turning the camera right while filming something.The camera rotates horizontally to the right, shifting the view leftward within the frame while maintaining its central axis."
168,"Turning the camera upwards while filming something.The camera tilts upward, with its lens pointing towards the sky, while the base remains level with the ground, creating a diagonal orientation."
169,"Twisting (wringing) something wet until water comes out.Hands grip the wet object tightly, fingers curled around it. The object is twisted in opposite directions, compressing and bending, forcing water droplets out from between the fingers."
170,"Twisting something.Hands grip an object, fingers curled around it. The wrists rotate inward or outward, creating a spiral tension along the object's length. The object's surface appears distorted from the twist."
171,"Uncovering something.A hand lifts a corner of a cloth, revealing a hidden object beneath. The cloth drapes partially over the object, creating layered folds."
172,"Unfolding something.A flat surface gradually expands outward, with folded layers extending symmetrically from the center, revealing smooth, continuous material without creases."
173,"Wiping something off of something.A hand holds a cloth pressed against a surface, with the cloth partially covering the object being wiped. The hand's fingers are slightly bent, applying pressure downward."
